{
    "$schema": "http://json-schema.org/draft-07/schema#",
    "type": "object",
    "properties": {
        "rate":{
            "lower":{
                "type":"number"
            },
            "upper":{
                "type":"number"
            }
        },
        "asset":{
            "lower":{
                "type":"number"
            },
            "upper":{
                "type":"number"
            }
        },
        "maturity":{
            "lower":{
                "type":"number"
            },
            "upper":{
                "type":"number"
            }
        },
        "num_u":{
            "lower":{
                "type":"number"
            },
            "upper":{
                "type":"number"
            }
        },
        "quantile":{
            "lower":{
                "type":"number"
            },
            "upper":{
                "type":"number"
            }
        },
        "lambda":{
            "lower":{
                "type":"number"
            },
            "upper":{
                "type":"number"
            }
        },
        "mu_l":{
            "lower":{
                "type":"number"
            },
            "upper":{
                "type":"number"
            }
        },
        "sig_l":{
            "lower":{
                "type":"number"
            },
            "upper":{
                "type":"number"
            }
        },
        "c":{
            "lower":{
                "type":"number"
            },
            "upper":{
                "type":"number"
            }
        },
        "g":{
            "lower":{
                "type":"number"
            },
            "upper":{
                "type":"number"
            }
        },
        "m":{
            "lower":{
                "type":"number"
            },
            "upper":{
                "type":"number"
            }
        },
        "y":{
            "lower":{
                "type":"number"
            },
            "upper":{
                "type":"number"
            }
        },
        "v0":{
            "lower":{
                "type":"number"
            },
            "upper":{
                "type":"number"
            }
        },
        "speed":{
            "lower":{
                "type":"number"
            },
            "upper":{
                "type":"number"
            }
        },
        "eta_v":{
            "lower":{
                "type":"number"
            },
            "upper":{
                "type":"number"
            }
        },
        "sigma":{
            "lower":{
                "type":"number"
            },
            "upper":{
                "type":"number"
            }
        },
        "rho":{
            "lower":{
                "type":"number"
            },
            "upper":{
                "type":"number"
            }
        }
    },
    "additionalProperties": false
}