{
    "lambda": {
      "lower": 0,
      "upper": 4
    },
    "mu_l": {
      "lower": 0,
      "upper": 1
    },
    "sig_l": {
      "lower": 0,
      "upper": 0.6
    },
    "v0": {
      "lower": 0,
      "upper": 2
    },
    "speed": {
      "lower": 0,
      "upper": 2
    },
    "eta_v": {
      "lower": 0,
      "upper": 0.5
    },
    "sigma": {
      "lower": 0,
      "upper": 1
    },
    "rho": {
      "lower": -1,
      "upper": 1
    }
  }