{
    "v0": {
      "lower": 0,
      "upper": 0.9,
      "types":"float"
    },
    "speed": {
      "lower": 0,
      "upper": 2,
      "types":"float"
    },
    "eta_v": {
      "lower": 0,
      "upper": 0.5,
      "types":"float"
    },
    "sigma": {
      "lower": 0,
      "upper": 1,
      "types":"float"
    },
    "rho": {
      "lower": -1,
      "upper": 1,
      "types":"float"
    }
}