{
    "c":{
        "lower":0,
        "upper":10,
        "type":"float"
    },
    "g":{
        "lower":0,
        "upper":20,
        "type":"float"
    },
    "m":{
        "lower":0,
        "upper":20,
        "type":"float"
    },
    "y":{
        "lower":-2,
        "upper":2,
        "type":"float"
    },
    "v0": {
      "lower": 0,
      "upper": 2,
      "type":"float"
    },
    "speed": {
      "lower": 0,
      "upper": 2,
      "type":"float"
    },
    "eta_v": {
      "lower": 0,
      "upper": 0.5,
      "type":"float"
    },
    "sigma": {
      "lower": 0,
      "upper": 1,
      "type":"float"
    },
    "rho": {
      "lower": -1,
      "upper": 1,
      "type":"float"
    }
  }